slug,lab,text,posted
interview-reverse-questions,career,面接の逆質問、何を聞けば評価が上がるか /  / 面接の最後に聞かれる「何か質問はありますか」は、意欲を確認する場ではなく評価の材料になっている。評価につながりやすい逆質問の作り方を整理する。 /  / 続きはプロフィールのリンクから、人生ラボのキャリア研究所で。,FALSE
resignation-agency-when-to-use,career,退職代行、使うべきかどうかの判断基準 /  / 退職代行には弁護士・労働組合・民間業者という異なる運営形態があり、できることが法的に異なる。利用を検討する前に知っておきたい違いを整理する。 /  / 続きはプロフィールのリンクから、人生ラボのキャリア研究所で。,FALSE
nursing-care-job-first-step,career,介護職という選択肢、未経験・ブランクからでも始めやすい理由 /  / 介護職は人手不足のイメージが先行しがちだが、未経験・ブランクありでも間口が広い分野でもある。実際の入職ルートと制度上の注意点を整理する。 /  / 続きはプロフィールのリンクから、人生ラボのキャリア研究所で。,FALSE
resume-screening-basics,career,職務経歴書、書類選考を通過させるための基本形 /  / 職務経歴書は経歴を並べるだけでは通過率が上がりにくい。採用担当者が短時間で判断できる基本の型を整理する。 /  / 続きはプロフィールのリンクから、人生ラボのキャリア研究所で。,FALSE
transfer-notice-first-steps,career,異動辞令が来たとき、まず確認したいこと /  / 異動辞令を受け取った直後は動揺しやすい。感情的な受け止め方の前に、実務として確認しておきたい項目をチェックリストとして整理する。 /  / 続きはプロフィールのリンクから、人生ラボのキャリア研究所で。,FALSE
transfer-decision-checklist,career,転職すべきか迷ったら見る、判断基準の整理法 /  / 「今の会社が嫌だから辞めたい」で動くと高確率で後悔する。会社への不満か、仕事内容への不満かを切り分けるための3つの質問を紹介する。 /  / 続きはプロフィールのリンクから、人生ラボのキャリア研究所で。,FALSE
ai-contract-review-caution,ai,AIに契約書チェックを頼むときの注意点 /  / AIに契約書のチェックを任せると効率は上がるが、法的な最終判断まで委ねると見落としのリスクがある。頼み方と注意点を整理する。 /  / 続きはプロフィールのリンクから、人生ラボのAI研究所で。,FALSE
claude-projects-getting-started,ai,Claude Projectsの使い方、業務効率化の第一歩 /  / Claude Projectsは、ナレッジとカスタム指示をひとまとめにして会話を進められる機能である。基本的な使い方と、業務で活かすための考え方を整理する。 /  / 続きはプロフィールのリンクから、人生ラボのAI研究所で。,FALSE
ai-work-consultation-prompts,ai,AIに仕事の相談をするときのプロンプトの作り方 /  / 仕事の悩みをAIに相談しても、漠然とした回答しか返ってこないことがある。相談の質を上げるための情報の渡し方を整理する。 /  / 続きはプロフィールのリンクから、人生ラボのAI研究所で。,FALSE
automate-meeting-notes-with-free-ai,ai,無料AIツールだけで議事録作成を自動化する方法 /  / 議事録作成は手間がかかる作業の一つだが、無料枠のあるAIツールを組み合わせるだけでも、録音・文字起こし・要約までを自動化しやすい。 /  / 続きはプロフィールのリンクから、人生ラボのAI研究所で。,FALSE
one-prompt-framework,ai,プロンプトの「型」を1つ覚えるだけで、AIとの仕事は変わる /  / 毎回ゼロから文章を考えてAIに指示するのは非効率になりやすい。基本的な型を1つ覚えるだけで、指示の精度と再現性が上がるという考え方を紹介する。 /  / 続きはプロフィールのリンクから、人生ラボのAI研究所で。,FALSE
chatgpt-vs-claude,ai,ChatGPTとClaude、結局どっちを使えばいいのか /  / 「どっちが優れているか」ではなく「どんな使い方ならどっちが向いているか」で考えると選びやすくなる。AI初心者向けに、実用面での違いを整理する。 /  / 続きはプロフィールのリンクから、人生ラボのAI研究所で。,FALSE
kids-smartphone-when-to-start,childcare,子供にスマホをいつから持たせるか、判断基準 /  / 子供にスマホを持たせる平均年齢は年々下がっているが、平均に合わせることが目的ではない。年齢の目安と、判断に使える視点を整理する。 /  / 続きはプロフィールのリンクから、人生ラボの育児研究所で。,FALSE
tantrum-phase-how-long,childcare,イヤイヤ期はいつまで続く？親ができる対処法 /  / イヤイヤ期の時期や長さには個人差があるが、一般的な目安を知っておくと見通しが立てやすくなる。よく挙げられる対処法もあわせて整理する。 /  / 続きはプロフィールのリンクから、人生ラボの育児研究所で。,FALSE
dual-income-morning-routine,childcare,共働き家庭の朝の時短ルーティン、実際にやっている工夫 /  / 共働き家庭の朝は、保育園の準備と身支度が重なり慌ただしくなりやすい。前日の準備や役割分担など、実際に取り入れられている工夫を整理する。 /  / 続きはプロフィールのリンクから、人生ラボの育児研究所で。,FALSE
kids-lessons-when-to-start,childcare,子どもの習い事、始める時期の目安と選び方 /  / 子どもの習い事は種類によって始めやすい時期の傾向が異なる。一般的な目安と、家庭ごとに判断が分かれる選び方の視点を整理する。 /  / 続きはプロフィールのリンクから、人生ラボの育児研究所で。,FALSE
nursery-settling-in-period,childcare,保育園の「慣らし保育」、乗り切るための実務知識 /  / 慣らし保育は期間も進み方も家庭や園によって差がある。一般的な目安と、職場復帰のタイミングとの擦り合わせ方を実務的に整理する。 /  / 続きはプロフィールのリンクから、人生ラボの育児研究所で。,FALSE
nursery-prep-checklist,childcare,保育園の入園準備、何から手をつければいいか /  / 入園が決まった直後は情報が多く焦りやすい。何を、いつ、どの順番で準備すればいいかを、家庭ごとの事情に左右されない基本の流れとして整理する。 /  / 続きはプロフィールのリンクから、人生ラボの育児研究所で。,FALSE
self-study-english-give-up-reasons,english,英語の独学で挫折する理由と、続けるための工夫 /  / 英語の独学は、学習内容そのものよりも「一人で進めること」自体が挫折の原因になりやすい。独学特有の壁と、乗り越えるための工夫を整理する。 /  / 続きはプロフィールのリンクから、人生ラボの英語研究所で。,FALSE
shadowing-effective-method,english,シャドーイングの効果的なやり方、続かない人向け /  / シャドーイングは効果を感じるまで時間がかかりやすく、途中でやめてしまう人も多い。効果的な進め方と、継続するための工夫を整理する。 /  / 続きはプロフィールのリンクから、人生ラボの英語研究所で。,FALSE
online-english-trial-comparison,english,オンライン英会話、無料体験で比較すべき3つのポイント /  / オンライン英会話の無料体験は、料金や講師の印象だけで比較すると選び方を誤りやすい。体験時に確認しておきたい3つの視点を整理する。 /  / 続きはプロフィールのリンクから、人生ラボの英語研究所で。,FALSE
parent-child-english-learning,english,親子で英語を学ぶメリット・デメリット、始める前に知っておきたいこと /  / 親子での英語学習には発音や抵抗感の面でメリットがある一方、効果には個人差もある。始める前に知っておきたい研究の現状とデメリットを整理する。 /  / 続きはプロフィールのリンクから、人生ラボの英語研究所で。,FALSE
toeic-score-plateau,english,TOEICスコアが伸びない人に共通する、学習の偏り /  / 一定期間勉強しているのにTOEICスコアが伸びない場合、単語量ではなく学習配分の偏りが原因になっていることが多い。偏りを把握する視点を整理する。 /  / 続きはプロフィールのリンクから、人生ラボの英語研究所で。,FALSE
why-english-study-fails,english,英語学習が続かない理由を、仕組みの問題として捉え直す /  / 「意志が弱いから続かない」と片づける前に、インプット量と復習のタイミングという2つの仕組みの問題として学習を見直す視点を紹介する。 /  / 続きはプロフィールのリンクから、人生ラボの英語研究所で。,FALSE
ideco-disadvantages-before-starting,money,iDeCoのデメリット、始める前に知っておくこと /  / iDeCoは税制優遇が注目されがちだが、始める前にデメリットも押さえておく必要がある。引き出し制限・手数料・元本割れリスクを整理する。 /  / 続きはプロフィールのリンクから、人生ラボのお金研究所で。,FALSE
life-insurance-review-timing,money,生命保険の見直し、タイミングの目安 /  / 生命保険は加入した時のまま放置されやすいが、必要保障額はライフイベントごとに変化する。見直しを検討したいタイミングを整理する。 /  / 続きはプロフィールのリンクから、人生ラボのお金研究所で。,FALSE
budget-app-simple-habit,money,家計簿アプリ、続けるためのシンプルな使い方 /  / 家計簿アプリは多機能なほど挫折しやすい。続けること自体を目的にした、シンプルな使い方の考え方を整理する。 /  / 続きはプロフィールのリンクから、人生ラボのお金研究所で。,FALSE
furusato-nozei-first-time,money,ふるさと納税、初めてでも失敗しない手順 /  / ふるさと納税は制度改正が続いており、以前の情報のまま進めると失敗しやすい。初めての人が押さえておきたい最新の手順と注意点を整理する。 /  / 続きはプロフィールのリンクから、人生ラボのお金研究所で。,FALSE
fx-margin-trading-basics,money,FXとは何か、始める前に理解しておきたい仕組みとリスク /  / FX（外国為替証拠金取引）は少額で始められる一方、レバレッジにより損失も拡大しやすい。仕組みとリスク、検討する際の判断材料を中立的に整理する。 /  / 続きはプロフィールのリンクから、人生ラボのお金研究所で。,FALSE
nisa-before-you-start,money,NISAを始める前に確認しておきたい3つのこと /  / NISAは非課税で投資できる制度だが、始める前に非課税枠の仕組み・資金を使わない期間・投資枠の使い分けを確認しておくと判断しやすくなる。 /  / 続きはプロフィールのリンクから、人生ラボのお金研究所で。,FALSE
variable-vs-fixed-rate,money,変動金利と固定金利、損得ではなく何で判断するか /  / 変動金利と固定金利は、どちらが得かという問いに正解がない。家計の余力・借入期間・金利上昇時の対応力という3つの軸で判断する考え方を整理する。 /  / 続きはプロフィールのリンクから、人生ラボのお金研究所で。,FALSE
